{
    "$schema": "https://json-schema.org/draft/2020-12/schema",
    "$id": "https://pneuma-lab.local/schemas/cloud-preparation-authorization.schema.json",
    "title": "Cloud Preparation Authorization",
    "description": "A signed, AWS-only, rolling preparation envelope. It is deliberately incapable of authorizing training, canonical experiments, scientific replication, unblinding, result promotion, or publication claims.",
    "type": "object",
    "x-pneuma-schema-kind": "cloud-manifest",
    "x-pneuma-version": "0.1.0",
    "required": ["record_kind", "schema_version", "frozen_timestamp", "status", "provider", "window_start", "window_end", "rolling_ceiling_usd", "per_job_ceiling_usd", "max_retries_per_job", "allowed_actions", "ledger_row_id", "ledger_row_sha256", "human_authorization"],
    "properties": {
        "record_kind": {"const": "cloud_preparation_authorization"},
        "schema_version": {"const": "0.1.0"},
        "frozen_timestamp": {"$ref": "#/$defs/timestamp"},
        "status": {"const": "authorized"},
        "provider": {"const": "aws"},
        "window_start": {"$ref": "#/$defs/timestamp"},
        "window_end": {"$ref": "#/$defs/timestamp"},
        "rolling_ceiling_usd": {"const": 250.0},
        "per_job_ceiling_usd": {"type": "object", "required": ["retrieval_or_image_build", "smoke_or_bounded_api_pilot"], "properties": {"retrieval_or_image_build": {"const": 75.0}, "smoke_or_bounded_api_pilot": {"const": 25.0}}, "additionalProperties": false},
        "max_retries_per_job": {"const": 2},
        "allowed_actions": {"type": "array", "uniqueItems": true, "minItems": 5, "items": {"enum": ["immutable_input_retrieval", "licence_contamination_audit", "container_build", "storage", "non_scientific_smoke", "bounded_api_pilot"]}},
        "ledger_row_id": {"type": "string", "pattern": "^CL-\\d{3}$"},
        "ledger_row_sha256": {"$ref": "#/$defs/digest"},
        "human_authorization": {"$ref": "#/$defs/human_authorization"}
    },
    "additionalProperties": false,
    "$defs": {
        "digest": {"type": "string", "pattern": "^[0-9a-f]{64}$"},
        "timestamp": {"type": "string", "pattern": "^\\d{4}-\\d{2}-\\d{2}T\\d{2}:\\d{2}:\\d{2}(?:\\.\\d+)?Z$"},
        "human_authorization": {"type": "object", "required": ["approver_id", "key_id", "granted_timestamp", "expires_timestamp", "body_sha256", "signature_ed25519"], "properties": {"approver_id": {"type": "string", "minLength": 1}, "key_id": {"type": "string", "pattern": "^[a-z0-9][a-z0-9-]{2,62}$"}, "granted_timestamp": {"$ref": "#/$defs/timestamp"}, "expires_timestamp": {"$ref": "#/$defs/timestamp"}, "body_sha256": {"$ref": "#/$defs/digest"}, "signature_ed25519": {"type": "string", "pattern": "^[0-9a-f]{128}$"}}, "additionalProperties": false}
    }
}
